{
  "status": "ok",
  "space_group_number": 59,
  "hall_symbol": "-P 2ab 2a",
  "lattice": [
    5.067615,
    5.17274,
    6.179115,
    90.0,
    90.0,
    90.0
  ],
  "input_atom_count": 8,
  "composition": {
    "Au": 6,
    "Dy": 2
  },
  "orbits": [
    {
      "id": "o000",
      "element": "Dy",
      "wyckoff": "2a",
      "parameters": [
        0.344977
      ]
    },
    {
      "id": "o001",
      "element": "Au",
      "wyckoff": "4e",
      "parameters": [
        0.505093,
        0.842017
      ]
    },
    {
      "id": "o002",
      "element": "Au",
      "wyckoff": "2b",
      "parameters": [
        0.33876400000000007
      ]
    }
  ],
  "frame_transform": {
    "matrix": [
      [
        0.9999999999999999,
        -2.465190328815662e-32,
        0.0
      ],
      [
        0.0,
        -6.162975822039155e-33,
        1.0
      ],
      [
        0.0,
        -1.0,
        0.0
      ]
    ],
    "origin_shift": [
      0.75,
      0.75,
      0.0
    ]
  },
  "round_digits": 6,
  "precision_corrections": []
}
