{
  "status": "ok",
  "space_group_number": 98,
  "hall_symbol": "I 4bw 2bw",
  "lattice": [
    6.40462644,
    6.40462644,
    6.40462644,
    136.01088905000003,
    136.01088905000003,
    63.96350103999998
  ],
  "input_atom_count": 8,
  "composition": {
    "Ag": 2,
    "Au": 2,
    "O": 4
  },
  "orbits": [
    {
      "id": "o000",
      "element": "Ag",
      "wyckoff": "4a",
      "parameters": []
    },
    {
      "id": "o001",
      "element": "Au",
      "wyckoff": "4b",
      "parameters": []
    },
    {
      "id": "o002",
      "element": "O",
      "wyckoff": "8f",
      "parameters": [
        0.2801290000000001
      ]
    }
  ],
  "frame_transform": {
    "matrix": [
      [
        0.5,
        -0.5,
        0.49999999999999994
      ],
      [
        -0.5,
        0.5,
        0.49999999999999994
      ],
      [
        -0.5,
        -0.5,
        0.49999999999999994
      ]
    ],
    "origin_shift": [
      0.0,
      0.0,
      0.0
    ]
  },
  "round_digits": 6,
  "precision_corrections": []
}
