{
  "status": "ok",
  "space_group_number": 224,
  "hall_symbol": "-P 4bc 2bc 3",
  "lattice": [
    4.840837,
    4.840837,
    4.840837,
    90.0,
    90.0,
    90.0
  ],
  "input_atom_count": 6,
  "composition": {
    "Ag": 4,
    "O": 2
  },
  "orbits": [
    {
      "id": "o000",
      "element": "Ag",
      "wyckoff": "4c",
      "parameters": []
    },
    {
      "id": "o001",
      "element": "O",
      "wyckoff": "2a",
      "parameters": []
    }
  ],
  "frame_transform": {
    "matrix": [
      [
        1.0,
        -9.01973988174092e-34,
        0.0
      ],
      [
        0.0,
        1.0,
        0.0
      ],
      [
        9.01973988174092e-34,
        9.01973988174092e-34,
        1.0
      ]
    ],
    "origin_shift": [
      0.75,
      0.75,
      0.75
    ]
  },
  "round_digits": 2,
  "precision_corrections": []
}
