{
  "status": "ok",
  "space_group_number": 62,
  "hall_symbol": "-P 2ac 2n",
  "lattice": [
    5.622973,
    5.952571,
    8.238917,
    90.0,
    90.0,
    90.0
  ],
  "input_atom_count": 20,
  "composition": {
    "In": 4,
    "O": 12,
    "Sm": 4
  },
  "orbits": [
    {
      "id": "o000",
      "element": "Sm",
      "wyckoff": "4c",
      "parameters": [
        0.06453700000000002,
        0.9795830000000002
      ]
    },
    {
      "id": "o001",
      "element": "In",
      "wyckoff": "4b",
      "parameters": []
    },
    {
      "id": "o002",
      "element": "O",
      "wyckoff": "4c",
      "parameters": [
        0.437752,
        0.13467800000000008
      ]
    },
    {
      "id": "o003",
      "element": "O",
      "wyckoff": "8d",
      "parameters": [
        0.190491,
        0.56838,
        0.18738100000000005
      ]
    }
  ],
  "frame_transform": {
    "matrix": [
      [
        0.0,
        0.9999999999999999,
        0.0
      ],
      [
        0.0,
        6.162975822039155e-33,
        1.0000000000000002
      ],
      [
        1.0000000000000002,
        0.0,
        0.0
      ]
    ],
    "origin_shift": [
      5.551115123125783e-17,
      0.0,
      0.0
    ]
  },
  "round_digits": 6,
  "precision_corrections": []
}
