{
  "status": "ok",
  "space_group_number": 83,
  "hall_symbol": "-P 4",
  "lattice": [
    10.354254,
    10.354254,
    3.864132,
    90.0,
    90.0,
    90.0
  ],
  "input_atom_count": 20,
  "composition": {
    "As": 8,
    "Sc": 12
  },
  "orbits": [
    {
      "id": "o000",
      "element": "Sc",
      "wyckoff": "4k",
      "parameters": [
        0.140328,
        0.811659
      ]
    },
    {
      "id": "o001",
      "element": "Sc",
      "wyckoff": "4j",
      "parameters": [
        0.280023,
        0.396628
      ]
    },
    {
      "id": "o002",
      "element": "Sc",
      "wyckoff": "2f",
      "parameters": []
    },
    {
      "id": "o003",
      "element": "Sc",
      "wyckoff": "1d",
      "parameters": []
    },
    {
      "id": "o004",
      "element": "Sc",
      "wyckoff": "1a",
      "parameters": []
    },
    {
      "id": "o005",
      "element": "As",
      "wyckoff": "4k",
      "parameters": [
        0.254108,
        0.582749
      ]
    },
    {
      "id": "o006",
      "element": "As",
      "wyckoff": "4j",
      "parameters": [
        0.044221999999999984,
        0.278073
      ]
    }
  ],
  "frame_transform": {
    "matrix": [
      [
        1.0,
        0.0,
        0.0
      ],
      [
        0.0,
        1.0,
        0.0
      ],
      [
        0.0,
        0.0,
        1.0
      ]
    ],
    "origin_shift": [
      0.0,
      0.0,
      0.0
    ]
  },
  "round_digits": 6,
  "precision_corrections": []
}
