{
  "status": "ok",
  "space_group_number": 36,
  "hall_symbol": "C 2c -2",
  "lattice": [
    6.56193249,
    6.56193249,
    5.474608,
    90.0,
    90.0,
    132.62080957000003
  ],
  "input_atom_count": 14,
  "composition": {
    "Ca": 2,
    "Co": 2,
    "O": 8,
    "Sm": 2
  },
  "orbits": [
    {
      "id": "o000",
      "element": "Ca",
      "wyckoff": "4a",
      "parameters": [
        0.10603499999999988,
        0.5140059999999999
      ]
    },
    {
      "id": "o001",
      "element": "Sm",
      "wyckoff": "4a",
      "parameters": [
        0.3883065000000001,
        0.48050699999999996
      ]
    },
    {
      "id": "o002",
      "element": "Co",
      "wyckoff": "4a",
      "parameters": [
        0.24875300000000022,
        0.9994109999999999
      ]
    },
    {
      "id": "o003",
      "element": "O",
      "wyckoff": "8b",
      "parameters": [
        0.24944699999999997,
        0.265236,
        0.7489989999999999
      ]
    },
    {
      "id": "o004",
      "element": "O",
      "wyckoff": "4a",
      "parameters": [
        0.08119500000000013,
        0.954245
      ]
    },
    {
      "id": "o005",
      "element": "O",
      "wyckoff": "4a",
      "parameters": [
        0.42474900000000027,
        0.05383199999999988
      ]
    }
  ],
  "frame_transform": {
    "matrix": [
      [
        0.5000000000000001,
        0.49999999999999994,
        0.0
      ],
      [
        -0.5000000000000001,
        0.5,
        0.0
      ],
      [
        -1.232595164407831e-32,
        0.0,
        0.9999999999999999
      ]
    ],
    "origin_shift": [
      0.0,
      0.0,
      0.0
    ]
  },
  "round_digits": 6,
  "precision_corrections": [
    {
      "site_id": "o001_1",
      "element": "Sm",
      "delta": [
        9.999999999177334e-07,
        0.0,
        0.0
      ]
    }
  ]
}
