{
  "status": "ok",
  "space_group_number": 139,
  "hall_symbol": "-I 4 2",
  "lattice": [
    4.55223999,
    4.55223999,
    4.55223999,
    122.44045171,
    122.44045171,
    85.82255785
  ],
  "input_atom_count": 3,
  "composition": {
    "Kr": 1,
    "F": 2
  },
  "orbits": [
    {
      "id": "o000",
      "element": "Kr",
      "wyckoff": "2a",
      "parameters": []
    },
    {
      "id": "o001",
      "element": "F",
      "wyckoff": "4e",
      "parameters": [
        0.2904070000000001
      ]
    }
  ],
  "frame_transform": {
    "matrix": [
      [
        0.5,
        -0.5,
        0.5
      ],
      [
        -0.5,
        0.5,
        0.5
      ],
      [
        -0.5,
        -0.5,
        0.5
      ]
    ],
    "origin_shift": [
      0.0,
      0.0,
      0.0
    ]
  },
  "round_digits": 6,
  "precision_corrections": []
}
