{
  "status": "ok",
  "space_group_number": 137,
  "hall_symbol": "-P 4ac 2a",
  "lattice": [
    5.392304,
    5.392304,
    7.622436,
    90.0,
    90.0,
    90.0
  ],
  "input_atom_count": 18,
  "composition": {
    "B": 8,
    "Rh": 8,
    "Th": 2
  },
  "orbits": [
    {
      "id": "o000",
      "element": "Th",
      "wyckoff": "2b",
      "parameters": []
    },
    {
      "id": "o001",
      "element": "B",
      "wyckoff": "8g",
      "parameters": [
        0.08387499999999992,
        0.402091
      ]
    },
    {
      "id": "o002",
      "element": "Rh",
      "wyckoff": "8g",
      "parameters": [
        0.00046200000000007346,
        0.10521899999999995
      ]
    }
  ],
  "frame_transform": {
    "matrix": [
      [
        0.9999999999999999,
        -4.930380657631324e-32,
        0.0
      ],
      [
        0.0,
        0.9999999999999999,
        0.0
      ],
      [
        0.0,
        6.162975822039155e-33,
        1.0
      ]
    ],
    "origin_shift": [
      0.25,
      0.75,
      0.75
    ]
  },
  "round_digits": 6,
  "precision_corrections": []
}
