{
  "status": "ok",
  "space_group_number": 16,
  "hall_symbol": "P 2 2",
  "lattice": [
    5.712303,
    5.716446,
    11.466788,
    90.0,
    90.0,
    90.0
  ],
  "input_atom_count": 12,
  "composition": {
    "Al": 2,
    "P": 2,
    "S": 8
  },
  "orbits": [
    {
      "id": "o000",
      "element": "Al",
      "wyckoff": "1a",
      "parameters": []
    },
    {
      "id": "o001",
      "element": "Al",
      "wyckoff": "1f",
      "parameters": []
    },
    {
      "id": "o002",
      "element": "P",
      "wyckoff": "1c",
      "parameters": []
    },
    {
      "id": "o003",
      "element": "P",
      "wyckoff": "1d",
      "parameters": []
    },
    {
      "id": "o004",
      "element": "S",
      "wyckoff": "4u",
      "parameters": [
        0.197847,
        0.27643500000000004,
        0.101916
      ]
    },
    {
      "id": "o005",
      "element": "S",
      "wyckoff": "4u",
      "parameters": [
        0.22359600000000002,
        0.19949300000000014,
        0.601208
      ]
    }
  ],
  "frame_transform": {
    "matrix": [
      [
        1.0,
        0.0,
        0.0
      ],
      [
        0.0,
        1.0,
        0.0
      ],
      [
        0.0,
        0.0,
        1.0
      ]
    ],
    "origin_shift": [
      0.0,
      0.0,
      0.0
    ]
  },
  "round_digits": 6,
  "precision_corrections": []
}
